{
  "$schema": "https://json-schema.org/draft/2020-12/schema",
  "title": "fare_zones",
  "type": "array",
  "items": {
    "type": "object",
    "required": ["id", "operator_id", "name_en"],
    "additionalProperties": true,
    "properties": {
      "id": { "type": "string" },
      "operator_id": { "type": "string" },
      "name_en": { "type": "string" },
      "base_fare_jpy": { "type": "number" },
      "calculation": { "type": "string" },
      "supplement_required": { "type": "boolean" },
      "notes": { "type": "string" }
    }
  }
}
